Notes,SiteID,RecoveryMethod,MeshSize,RecoveryMethodNotes
"the site was excavated in advance of the installation of a gas pipeline - before installation surveys was carried along the whole route of the pipeline; excavations at the site were carried out over a period of 2 months in the mid 1990s; the site is located in the commune of Saint-Gely du- Fesc (Herault) a dozen kilometers north Montpellier at a place called in the land register ""Puech of Vautes"" (Figure 1); it is located in the foothills of the limestone hills north of Montpellier garrigue, on lacustrine limestones; the site occupies an estimated area of c.1000-2000 m2 - only a third of which was affected by the construction of the pipeline; the remains of 4 houses and other ancillary structures were immediately visible; 5 phases of occupation were identified at the site - phase 1: final Neolithic group Ferrieres; phase 2: late/final Neolithic Ferrieres/Fontbouisse; phase 3: late Neolithic Fontbouisse; phase 4: Bell Beaker (evolved); (phase 5 = medieval-modern); archaeobotany: Buxo reports plant remains in samples dated to the late Neolithic/Fontbouisse; it's not exactly clear how many samples were investigated: Buxo states: 'We present here the results of the study of nine samples a/bot samples recovered in the excavation of the site of Vautes. Among them, only three samples produced plant remains' and then in the next paragraph: 'Of the 17 samples of sediment collected for a/bot studies, almost all come from the house 1 sector 2.' - taxa found in 3 samples are listed in figure 1; the samples studied plant remains were from stratigraphic units US 214 (fireplace) US 220 (base filling the oven 213) and US 223 (basal level of a layer of burning in house 1) - they were recovered (?by flotation) on sieves with meshes of 4, 1 and 0.5 mm. ",S3839,flotation,"4.0mm, 1.0mm, 0.5mm",NULL
"this site contained an Early Bronze Age large pit and a nearby burnt mound. Earlier activity at the site included a Middle Neolithic ring-ditch, and a double row of prehistoric pits was also found; Archaeobotany: Waterlogged plant remains were recorded in a lower layer of the Early Bronze Age pit. The sample was washed/processed with water, using a sieve of 0.25 mm mesh size. A wide variety of wild plants was represented, including species associated with aquatic and marginal environments. A small quantity of plant remains was also recorded in ditch F1, but this material is undated, so has not been included below. [Note from SC: I've only included edible species (e.g., according to PFAF) in the db entries]							",S3851,wet-sieving,0.25mm,NULL
"several events of Late Mesolithic occupation were recorded at this site, including construction of a hut, which later turned into a dump for debris from plant-processing and tool-making activities. Small hearths were recorded. Later activity was also discovered at this site; Archaeobotany: Charred plant remains were recorded in 67 samples from pit fills. Samples were washed/processed with water, using a sieve of 0.5 mm mesh size in some cases and 2 mm in other cases. Hazelnut shell and seed-type material was analysed by Carruthers, while parenchyma were analysed by Mason and Hather. Large quantities of hazelnut shell were present (quantities recorded by weight, rather than number of components). A total of 30,000-60,000 hazelnut shell fragments are estimated to have been present in pit fill F24 (which may represent the remains of a hut structure subsequently re-used as a dump). Other remains included crab-apple and other wild plants, including vegetative parenchyma. A small quantity of cereal remains was present; radiocarbon dating of the wheat grain demonstrated that it reflects later activity at this location. [SC: cereal remains assumed to be intrusive and not entered in db]",S3855,wet-sieving,"2.0mm, 0.5mm",NULL
"G (p55-69) records taxa ID from impressns (I only refer to tables/legends & brief abstract in English); pot & daub frags from pit contexts (103 daub frags had 491 impressns); wheat & barley ID in daub - only wheat in coarse pot; presence only in d/base",S3861,NULL,NULL,NULL
"H (p199-218+p10-11) IDs taxa from charred remains in 5 features (?possibly storage contexts); H gives ubiquity for cereals only in table 1 & total nos of all taxa in text, p10; presence given for taxa ID from impressions on 1200 sherds in 70 features",S3895,flotation,NULL,NULL
"H (p6-9) describes taxa ID from impressions in sherds & plaster(?) dated to the early Neo (TRB B = TRB ENI?), p6; 1 sample: St40 = mid Neo - not included here; descriptions & nos of taxa given in text - no table with full lists; presence only in d/base",S3896,NULL,NULL,NULL
"H (p11-12) describes taxa identified in pottery dated to the early Neolithic - TRB C (?ENI/II); he describes and gives numbers of specimens in his text but doesn't give a comprehensive list of taxa; presence only given in d/base",S3911,NULL,NULL,NULL
"M (p185-91) records taxa found in samples from the foundation trench (3 samples) & post pits (6 samples); volumes of samples not given; clay-rich samples were dried prior to processing; residues were also examined",S3936,"flotation, wet-sieving, wash-over",NULL,NULL
"the site is on like Biel in the canton of Berne (district Nidau); charred remains from the Cortaillod phase are recorded according to upper (2 samples), middle (11 samples) and lower (3 samples) cultural levels; Piening describes sample composition as follows: 1) lumps of firmly baked cereal grains, with charred and uncharred plant remains (sample 40 and 44) or sediment lumps (sample 30 and 39); 2) loose material containing charred and uncharred plant debris, sometimes mixed with loose sediment or chunks [NB. Piening only lists charred remains in table 1 but notes in the text (p69) that there are uncharred 'pieces of bark, moss plants, seeds of blackberry/raspberry (Rubus fruticosus / idaeus), wild strawberry (Fragaria vesca), poppy (Papaver sp.), isolated seeds of elderberry (Sambucus sp.) and from the family of gooosefoot and buckwheat family (Polygonaceae and Chenopodiaceae) and of the bladder cherry (Physalis alkekengi), half and whole pine needles, branch pieces, pieces of wood, a hazelnut (and also isolated cocoons of larvae)' - I haven't included these in the db entries]; charred remains in 7 samples from the middle Horgen phase are also recorded; Piening describes sample composition as follows: 1) lumps of charred cereal grains, adhering firmly to each other (samples 1-5, 7), and humid lumps, of friable limnic chalk-and together with it as a baked grain residues (sample 6); 2) loose material contained charred and uncharred plant remains, all mixed with sediment. [NB. Piening only lists charred remains in table 12 but notes in the text (p81) that there are uncharred 'pieces of wood, moss plants and seeds, especially of blackberry/raspberry (Rubus fruticosus/idaeus) and wild strawberry (Fragaria vesca)' - I haven't included these in the db entries]; samples were sorted dry or if 'disaggregation' of clumps of seeds/grains was necessary they were soaked in water (+HCl) and washed through a sieve (no mesh sizes given)",S4062,wet-sieving,NULL,NULL
"385 smpls taken in '83-'85 (p369) from pits & p/holes (from profiles at 5cm intervals); vols: 0.1-50dm3; 230 smpls/151 features contd charred remains - table 168 lists taxa in 153 features? (%s per 153); preservation poor & frags recorded for most taxa",S4072,wet-sieving,"1.0mm, 0.5mm",NULL
"H&H (p289-305) record taxa found in pits at 2 adjacent sites: Rubane (VeBI) & G de Blicquy (VeBII);  weights of samples in kg; in VeBI 2 structures are recorded as 'pit-silos' - 106 & 120; at both sites: 'isolated' & 'domestic' pits",S4127,wet-sieving,"2.0mm, 0.25mm",NULL
"B (p1-19) records taxa recovered from pits; 28 samples taken but only 16 had identifiable remains (vols: 1-3 dm3); deposits were sticky loess-loam & flotation was not possible; site excv from '79-'85; Wange is contemporaneous (on opposite bank of river)",S4187,wet-sieving,0.25mm,NULL
"B ('92, p1-19) records taxa from pits (& 1 pot?) ; 17 samples & 8 had ID remains (vols: 1-3 dm3); deps were sticky loess-loam so flotation impossible; site excv from '79-'85; Overhespen same date & on other bank of river ['85 taxa list slightly different]",S4188,wet-sieving,"0.5mm, 0.25mm",NULL
"recent excavations at Wangels, on the border of the Oldenburg channel in Eastern Holsatia unearthed rich archaeological deposits dating to the Mesolithic/early Neolithic and the middle Neolithic of the Funnel Beaker culture; archaeobotanical material from the middle Neolithic layer is presented here; Wangels is not a settlement site, but a place frequented at the waters edge, so that the finds layer had become mixed as a result of trampling by people and domestic livestock; the continuously rising sea level of the Baltic has sealed the layer until now; archaeobotany: two different types of samples were submitted for analysis: handpicked material from the wet-sieving process (ie, for the recovery of bones, shells, microliths, sherds and beads) and unsieved deposits; carbonised and uncarbonised (waterlogged) plant material was preserved in the middle Neolithic layer (see table 2); the handpicked samples comprised some specimens as small as cereal grains although in many cases only items as large as hazelnuts had been extracted (the taxa identified in the handpicked sample are included in the overall total/ubiquity entered in the db); a majority of taxa not preserved by charring are wet-loving species (e.g. non economic plants); in the d/base I've been consistent with other sites & entered all charred remains+ waterlogged taxa (e.g. fruits&nuts etc.) which had obviously been deliberately collected & brought to the site (e.g. Corylus.,Fragaria, Malus, etc.); if a taxon is preserved by charring & waterlogging the ubiquity & total no relate to the former; if not stated items are uncharred",S4189,"wet-sieving, hand-picked",NULL,NULL
"H (p194-233) ID 127 impressions on 68 sherds (=WHH); no context information - taxa are listed according to catalogue nos for sherds; presence only in d/base; F (p139-56) describes taxa in samples from trenches across  the ditches (=WH); vol=c.10l",S4235,"machine flotation",0.3mm,"Fairbairn's samples only; no details given for Helbaek's samples"
"archaeobotany: layer J is sampled; 2 types of samples are distinguished for the Zurichsee sites: so-called ""closed find complexes""  gFK: geschlossenen Fundkomplexen are clearly visible accumulations of macrofossils, e.g., conspicuous clusters of fruit seeds or collections of crop plants (e.g., storage contexts) that represent deposition over a short time and therefore represent a 'snapshot' at the time of deposition; and so-called ""open find complexes' oFK: offenen Fundkomplexen that are taken from a uniform grid covering the excavation area or in the form of profile columns and represent average layer conditions and probably reflect a longer period of deposition and often contain a high number of taxa; data entered in db are taken from table D358 in which ubiquities of taxa in the oFK samples are recorded [numbers of taxa are not given] - for AKAD/Pressehaus it isn't clear how many 'open find complex' samples are included in the calculations (table 36, 221 lists 58, 70, 128 respectively for FP, FP/EP/Proben total for layer J);  Note: a majority of taxa not preserved by charring are wet-loving species (e.g. non economic plants); in the d/base I've been consistent with other sites & entered all charred remains+ waterlogged taxa (e.g. fruits&nuts etc.) which had obviously been deliberately collected & brought to the site (e.g. Corylus, Fragaria, Malus, etc.); if a taxon is preserved by charring & waterlogging the ubiquity & total no relate to the former",S4288,wet-sieving,"8.0mm, 4.0mm, 2.0mm, 1.0mm, 0.5mm, 0.25mm",NULL
"KHrI:5A+B 16 sples (14 prf/2 srf); KHrII:4A+B 25 sples (10 prf/14 srf); KHrIII:4E 45spls (17prf/28srf); open (refuse) & closed (areas of high conc) contexts spled; most records from this phase were entered in the AHRC db (see details on previous spreadsheets) - additional records are taken from table D358 (1997) in which ubiquities of taxa in oFK samples are recorded [numbers of taxa are not given]; for more details see other Zurichsee sites; Note: a majority of taxa not preserved by charring are wet-loving species (e.g. non economic plants); in the d/base I've been consistent with other sites & entered all charred remains + waterlogged taxa (e.g. fruits&nuts etc.) which had obviously been deliberately collected & brought to the site (e.g. Corylus, Fragaria, Malus, etc.); if a taxon is preserved by charring & waterlogging the ubiquity & total no relate to the former. There is a discrepancy between the sample numbers and ubiquity scores, which could not be resolved because the raw counts were not provided in the original report",S4291,wet-sieving,"8.0mm, 4.0mm, 2.0mm, 1.0mm, 0.5mm, 0.25mm",NULL
"2 types of samples are distinguished for the Zurichsee sites: so-called ""closed find complexes""  gFK: geschlossenen Fundkomplexen are clearly visible accumulations of macrofossils, e.g., conspicuous clusters of fruit seeds or collections of crop plants (e.g., storage contexts) that represent deposition over a short time and therefore represent a 'snapshot' at the time of deposition; and so-called ""open find complexes' oFK: offenen Fundkomplexen that are taken from a uniform grid covering the excavation area or in the form of profile columns and represent average layer conditions and probably reflect a longer period of deposition and often contain a high number of taxa; data entered in db are taken from table D358 in which ubiquities of taxa in the oFK samples are recorded [numbers of taxa are not given]; Note: a majority of taxa not preserved by charring are wet-loving species (e.g. non economic plants); in the d/base I've been consistent with other sites & entered all charred remains + waterlogged taxa (e.g. fruits&nuts etc.) which had obviously been deliberately collected & brought to the site (e.g. Corylus, Fragaria, Malus, etc.); if a taxon is preserved by charring & waterlogging the ubiquity & total no relate to the former; [NB: the Cortaillod data replace (now deleted) previous records for the older Cortaillod - layer 6]",S4298,wet-sieving,"8.0mm, 4.0mm, 2.0mm, 1.0mm, 0.5mm, 0.25mm",NULL
"B (p46, table 2) records remains in area 3; sples were taken within (F3006) & just below (F3009) a charcoal lens in colluvium - vols 4 & 12l; 50% of residues sorted; very few ID remains [NB sples from redeposited sediments]",S4307,"machine flotation","1.0mm, 0.3mm",NULL
"B (p157-66) records charred remains in 7 pits; smple vols: 2-8dm3; large nos of C album seeds in 2 smpls & B states that they may have been deliberately collected; max & min nos of chaff items listed (many frags so exact nos not poss); max given in d/base",S4309,wet-sieving,NULL,"author refers to recovery on a fine mesh (no details of exact size)"
"B (p1-10) describes remains found in 'well dated pit fills'; if several layers were identified in the pits these were sampled separately; vols given in dm3; B lists numbers of taxa per sample; 3 samples had +/- high densities: 5-2, 8-2 & 9-2",S4320,NULL,NULL,NULL
"B (p157-66) records charred remains in 2 pits; sample vols: 3 & 4dm3; max & min nos of chaff items listed (there were many frags so B states it was not possible to give exact nos); max no given in d/base",S4324,wet-sieving,NULL,"author refers to recovery on a fine mesh (no details of exact size)"
"P (119-140) lists charred remains in 52 sples/28pits (BBg) & in 1 storage context (122-88: BBgs) - recorded separately  in d/base; sple sizes = 0.5-9l; deposits soaked before sieving; sub-sples examined (vols given in her table 1a)",S4327,wet-sieving,"2.5mm, 1.0mm, 0.315mm",NULL
"details of excavation & a/bot is in Gallia Prehistoire 49; Bouby examined taxa in 1 sample from pit 134/layer 50449; vol floated: 161.5l; B gives a list of taxa with nos of whole grains + frags; from 2007 report: the site is located in the plain of Vaise in the west of Lyon forming a low terrace ledge a little over a fifty meters wide, at the junction between the eastern slope of the plateau Duchere (alt. 250 m) and the Saone plain (alt. 175 m); except for a few isolated finds the remains of the Bronze Age focus in the north of the excavation area (94.1 and 94.8 sectors, respectively sector J Street Mouillard 25th RTS and sector L, SNCF basins; Jacquet dir., 1998, fig. 11 and 12) covering a length of 110 m along the axis north-east/south-west (fig. 2) and a total area of approximately 3000 m2; houses and associated structures (e.g., pits-silos, hearths, etc., were excavated in each occupation phase: from early Neolithic to final BA); Vital et al's 2007 report represents a revision of interpretations according to reworking of data and reassessment of chronologies; archaeobotany: Bouby records taxa found in each period from the early Neolithic to the final BA (for each taxon he gives total items identified and frequency of occurrence, i.e., number of samples in which the taxon is recorded; table 1); numbers of samples/volume of sediment processed are also given per period (many more samples are taken in the BA than in the Neolithic); contexts sampled are not specified for each period but general statements about the sampling of houses, postholes and pits-silos are made; wet-sieving is used to recover remains (which are all charred) and the minimum mesh size is 0.5mm - with the exception of some Beaker and BA samples for which a 1mm mesh was used (samples aren't distinguished on the basis of mesh size in table 1); Bouby notes that preservation is poor and fragmentation high (for the MNeo, LNeo and EBA Bouby records fragments of charred 'organic matter' - not entered separately in db)",S4330,wet-sieving,0.5mm,NULL
"T (p303-8) lists taxa in 19 sples/19 contexts; preservation by charring & imprssns:  tab1: no details given; tab2: some taxa listed as imprssns only; nos of taxa in 19 samples amalgamated; presence only for taxa ID as impressions; ubiquity not given",S4332,NULL,NULL,NULL
"B (p129-37) divides activity at the site into 2 +/-distinct periods: phases I-VII are included in the earlier of the 2; P (p126+App14) records taxa in 7 smpls from phases V & VII; smpls of 0.7-4 l were from ditch segments; 1 taxon ID from an impression",S4333,flotation,NULL,NULL
"S (p283) records 2 shallow pits with basal layers comprising grey soil + charcoal; C (p286-7) records taxa from the lowest levels in the 2 pits (F246&247); samples sizes of 2l & 5l; preservation poor & very few ID remains",S4334,wet-sieving,0.3mm,NULL
"T (p303-8) gives presence only for taxa  in 246 smpls/91 cntxts (LBK/StichBK/Lengyel smpls amalg); reference in text  to preservation by charring & impressions but  in table 1 this isn't specified for each taxon; weeds listed not ID; ubiquity not given",S4336,NULL,NULL,NULL
"K-M (p33-8) describes charred remains in samples (nos not given) from the early Meso occ layers; bulk peat samples were taken from every 'distinct deposit - e.g. charcoal-rich'; total volume (dry) of 16dm3 examined",S4338,wet-sieving,"2.5mm, 2.0mm, 1.0mm",NULL
"R (p40) describes this as a pit pre-dating the henge &  to the NW of the structure; C (p250-3) records that 61 l from the primary fill were processed  - residues also sorted; a single list of taxa in table 133 (?nos of samples)",S4344,flotation,0.25mm,NULL
"B&R (p37-57) list taxa in pits; total of 36 dm3 processed from 3 samples; B&R give nos of taxa per sample (table 4, p49); all samples have >20 items per dm3; B&R record impressions in pottery (not referred to in d/base - same taxa as in charred remains)",S4346,wet-sieving/dry-sieving,"0.5mm, 0.25mm",NULL
"B&R (p37-57) list taxa in a single sample/pit; 0.5 dm3 processed; B&R give nos of taxa per sample - table 4, p49; in this sample they record a density of 482 items per dm3",S4348,wet-sieving/dry-sieving,"0.5mm, 0.25mm",NULL
"B&R (p37-57) list taxa in a single sample/pit; 0.7 dm3 processed; B&R give nos of taxa per sample - table 4, p49; in this sample they record a density of 28.6  items per dm3",S4350,wet-sieving/dry-sieving,"0.5mm, 0.25mm",NULL
"P (125-46) records charred remains from '91-2 excavations; 60 smpls taken from 17 pits (13 LBK) - vols: 0.25-31kg; smpls soaked in water/hperoxide before sieving; 3 groups of smpls: random (x11pits), waste (x1pit), storage (x1pit); preservation poor",S4355,wet-sieving,"2.5mm, 1.0mm, 0.315mm",NULL
"H (p14-15) describes taxa identified from impressions in pottery dated to the late early Neolithic (or transitional EN/MN) - ?TRB ENII; he describes & gives numbers of specimens in his text but does not provide a full list of taxa; presence only in d/base",S4358,NULL,NULL,NULL
"B describes taxa ID in '86/7 seasons; sampling is same as outlined for KHr - surface & profile samples taken from 'open'/'closed'/single find contexts; total=103 samples; App4/2: nos+%'s of all charred taxa &/or waterlogged economic seeds/fruits in d/base",S4359,wet-sieving,NULL,NULL
"P (p1-17; 239-271) records charred remains from 2 separate pits (both Rossen) excavated in '73 & '77; both samples were soaked before sieving; '73 sample =?g '- 77 sample=5,117g; the taxa lists have been amalgamated",S4363,wet-sieving,"2.5mm, 1.0mm, 0.5mm, 0.315mm",NULL
"H (p115-7) describes charred remains found in 2 pits (F8 & F9); no mention of recovery method used or sample sizes; H records that the remains are very corroded making identification difficult; only 3 cereal taxa & 1 legume were found",S4364,NULL,NULL,NULL
"B (p2) describes charred remains in 2 samples taken from an ashy patch described by the excavators as a kind of hearth; 1 sample was handpicked during excavation the 2nd was sieved from a soil sample (sample size 5dm3)",S4365,hand-picked/dry-sieving,0.5mm,NULL
"B (p1-10) describes remains found in 'well dated pit fills' at the site (12 samples); if several layers were identified in a pit they were sampled separately; she gives vols in dm3 & lists nos of taxa per sample",S4367,NULL,NULL,NULL
"B&R (p37-57) list taxa in pits; a total of 12.25 dm3 processed from 6 samples; B&R give nos of taxa per sample - table 4, p49; all samples have >20 items per dm3 (Ge-U9 has a density of 748 items/dm3)",S4368,wet-sieving/dry-sieving,"0.5mm, 0.25mm",NULL
"G (p55-69) records taxa ID from impressns (I only refer to tables/legends & a brief abstract in English); pot & daub frags from 6 pit contexts (44 daub frags had 257 impressns); wheat & barley ID in daub - only wheat in coarse pot; presence only in d/base",S4370,NULL,NULL,NULL
"P/V (p495-97) record charred cereals on/in layer XI of cave; roof collapse preserved large spread of cereals (20m2) between 2 hearths (1&3); grains/chaff represent stored crops - no evidence of containers; nos of items not given only approx proportions",S4371,NULL,NULL,NULL
"E (p75) describes 3 cereal grains found in a pottery vessel; 3 +/- spherical seeds also recorded for which identifications are not given",S4375,NULL,NULL,NULL
"excavation took place  in the entrance of the cave (in 1970 & 2001/2); 5 samples taken during the 2001 season: 1 from a hearth & 4 from levels in grids 12L-N; no recovery method described; sample sizes: 6-19l; density of remains low & fragmentation high",S4376,NULL,NULL,NULL
"B (2002 p33-40) records remains in 2 pits (2 samples); vol = 16dm3; one list with nos of taxa from both samples is given; B (in prep) records same samples but some IDs are changed & different taxa - d/base represents later publication; ubiquity not given",S4377,"bucket flotation","2.0mm, 0.5mm",NULL
"K-M (p23-31) describes remains in 12 samples from hearths & shallow pits; recovery by wet-sieving & flotation; vols are given for flots - not for original samples; K-M mentions some taxa in text that are not in table 1 (p25)From R&H 2002: located on Sjaelland; the site was excavated in 1988 (Nielsen, Kalundborg Museum) in advance of construction work; it was excavated in its entirety and large quantities of lithics were recovered - dated to the early Ertebolle period (confirmed by 14C dates); originally the site was on a small island close to the shore of the fjord; the site location was ideal for fishing as indicated by the elaborate system of fish traps found leading out to the mouth of the fjord; the settlement remains comprised a number of hearths and a scattering of very shallow pits and/or natural depressions (e.g., H which is interpreted as a trampled area at the entrance of the dwelling); the original soil (?occupaton layer) was absent but the fills of pits and hearths were found in situ; an overlying gytta layer had sealed preventing dehydration/oxidation and later disturbance; archaeobotany: during the excavation large soil samples were taken from the hearths and pits/depressions - hand picked samples of larger charcoal items were also collected; soil samples were wet-sieved through meshes of 1mm and 4mm; sieve residues were dried and the various fractions + hand-picked samples were sent to the Danish National museum NSR; the hand-picked samples were found to contain mainly wood charcoal and hazelnuts; 12 large samples from 7 contexts were found to be rich and so these were chosen for further analysis - the original fractions were processed again using flotation with a mesh of 0.5mm; both charred and uncharred plant remains were found in the samples - most of the identifiable taxa came from pit H [I have no idea how Robinson's data relate to that in Kubiak-Martens 2002 report - but his taxon list is more comprehensive; I've combined taxa from K-M's data if missing from Robinson's list]",S4379,"flotation, wet-sieving",0.5mm,NULL
