Notes,SiteID,RecoveryMethod,MeshSize,RecoveryMethodNotes
"M (p47-49) describes impressions in pottery; contextual information is limited & sherds identified by museum accession nos; M says there are 'some unusually large impressions, including entire spikelets of cereals and a fruitstone of sloe', p48; presence only in d/base",S1011,NULL,NULL,NULL
"L (p76-7) records 2 taxa collected for use at the site; remains were found in the occ layer & in a refuse area; it appears that there was no systematic recovery of remains & so nos of specimens are not recorded; I have assumed the taxa were waterlogged?",S1042,NULL,NULL,NULL
"7 pits sampled & from 2 only modern seeds were retrieved; results from 8 sples from 5 pits reported by J&H (tables 4-3/4-4); taxa from 2 sples were hand-picked (all taxa amalgamated in d/b); crop spp in all samples & large nos in 3 samples from pit 100",S1051,"flotation, hand-picked",5mm-0.1mm,NULL
"the settlement Alleshausen-Grundwiesen (Gde Alleshausen district of Biberach) lies on the western edge of Federseeriedes; it is located just below the edge of the slope of the ancient moraine; the cultural layers have been well preserved in/under peat layers; in spring 1989 Franz Herzog found in recently opened drainage ditches worked timber, stones, charcoal and pottery sherds (Schlichtherle 1989, 59); in 1990 work was begun with test probes which led to further campaigns in summer 1992; the soundings recorded substantial archaeological finds only in the topmost layers; approximately 100 square meters of the settlement area was excavated (Koninger & Schlichterle 2004); the 1 m thick cultural layers were composed of organic detritus, wood and clay and date to the late Neolithic Goldberg III group; archaeobotany: profile samples were taken through cultural layers (all recorded in separate tables) and also single samples were taken across the settlement (I've only recorded taxa in these single samples which are summarised in table 19); single samples: 6 samples are taken from the area of the enclosure at the western end of section 3, 6 out of the area between the fence and house 4; other individual samples come from the houses themselves including the fireplaces and the areas beneath the floors (total:28); samples were washed on a set of sieves (mesh sizes: 8, 4, 2, 1, 0.5 and 0.25 mm); a total of nearly 20 litres of sample material were examined; since no fire existed in the settlement layers almost exclusively uncharred/waterlogged plant remains are preserved, and only rarely were charred seeds or fruits found - a majority of these were wet-loving species (e.g. non economic plants); in the d/base I've been consistent with other sites & entered all charred remains+waterlogged taxa (e.g. fruits&nuts etc.) which had obviously been deliberately collected & brought to the site (e.g. Corylus, Fragaria, Malus, etc.); if a taxon is preserved by charring & waterlogging the ubiquity & total no relate to the former  ",S1066,wet-sieving,"8.0mm, 4.0mm, 2.0mm, 1.0mm, 0.5mm, 0.25mm",NULL
"the site is located in eastern Switzerland (Canton Thurgau) on the southern shore of Lake Constance; to date there are 7 partially excavated prehistoric settlement sites located at Bleiche; the archaeological layers extend to heights from 393.90 to 397.00 m asl. and since these layers are now up to several meters below the current surface, mostly in the groundwater range, exploratory excavations are difficult; when the lake levels dropped in 1882 the first evidence of pile dwellings was discovered; in the summer of 1993, the first major campaign of excavation in  Arbon Bleiche 3 was carried out to investigate an area of about 470 square meters (at this time the sections 1 and 2 opened in 1983 were integrated into the excavation area and thus were classified as stratigraphically secure); in the summer of 1994 an area of 300 m2 was opened in the direction of the former lake and in 1995 a further 280 m2 was excavated in the W; organic cultural layers (= KS: KSO, KSM, KSU) cover the entire excavation area and are separated from the overlying layer of fire debris (= BRA); archaeobotany: the cultural layer was systematically sampled in Arbon Bleiche 3 - this was done by taking so-called surface samples, i.e. cultural layer material from every second square metre or every second quarter of a square metre and also profile columns recovered at more or less regular intervals over the entire excavated area; in addition, subjective sampling was carried out for human and animal faecal samples; both types of systematically recovered samples were examined by various disciplines: bulk surface samples (mostly 3 litres; from 8 houses and different settlement areas: n=73 samples/340L – only 33*/185L of which could be included in the analyses/calculations) were examined for a vast range of macrobotanical remains, for small zoological remains and for remnants of animal dung; profile columns (taken at 12 locations on the onshore transect of the W part of the settlement; from 6 houses and 5 areas between; 7.3L of cultural layers) were analysed for macrobotanical remains (seeds, fruits), microbotanical remains (mainly pollen), small animal remains, molluscs, sediment grain sizes and micromorphological features [there is much discussion in the volume about the 'appropriate' samples sizes to take to achieve a 'representative' suite of plant taxa - not entirely sure what the conclusions were]; I have entered data from Abb. CD 75 (listing taxa identified in the bulk samples - db entries refer to the fully quantified data for the 33* samples); Note: a majority of taxa not preserved by charring are wet-loving species (e.g. non economic plants); in the d/base I've been consistent with other sites & entered all charred remains+ waterlogged taxa (e.g. fruits&nuts etc.) which had obviously been deliberately collected & brought to the site (e.g. Corylus, Fragaria, Malus, etc.); if a taxon is preserved by charring & waterlogging the ubiquity & total no relate to the former",S1104,wet-sieving/wash-over,"0.5mm, 0.2mm",NULL
"the site is in the Vallon de Marcieu located on the edge of the eastern massif; in the 1980s and 1990s the team of Grenoble ""Alpine Settlement and Palaeoenvironment"" survey group found many sites in Chartreuse and Vercors (under the direction of P. Bintz and R. Picavet); in the context of these findings the excavation programmed for ALP 1 was initiated in 1994 first under the direction of P. Bintz, then from 1999 that of D. Pelletier; the deposit was chosen because it had deposits that allowed easy definition of stratigraphic units - the archaeological sequence covers the Middle Mesolithic up to historical periods; the site covers an area of about 80 m2 with a band 3-4m long and 1.5m wide that is protected from the rain by the rock overhang; many arrow heads were found and the spectrum of fauna includes only wild taxa including deer, wild boar, ibex and chamois and the suggestion is that the site was used as a hunting camp; the shelter was repeatedly occupied (Pelletier et al. 2000); the a/bot analysis focuses on Middle Neolithic levels excavated in 2004 and 2005 (Pelletier 2004, 2005); 2 radiocarbon dates were obtained from hearths (Fy01, Fy02) in the Neolithic sequence - they place the occupation between 4450 and 4250 BC. (Middle Neolithic 1); archaeobotany: the area excavated during the two seasons 2004 and 2005 (sector 1) is characterized by the presence of three hearths that comprise very organic sediment - the a/bot study reported by LM focuses on hearths Fy 02 in IJ 5-6 and Fy 03 in H4; all plant remains were charred; for logistical reasons it was not possible to wet-sieve on site or to transport more than one ton of sediment - instead samples were dry-sieved on a large mesh (c. 6 mm) on site; sediment that passed through the mesh was collected on a plastic sheet and this was then processed at IPSA in Basel in a manner similar to that used for samples from Chenet des Pierres: the sediment was frozen and then wet-sieved on meshes of 4 mm, 2 mm and 0.5 mm; as with La Grande Rivoire fragments were converted to 'whole grain/seed equivalents' and presented in table 13 (see appendices for full listing)",S1153,wet-sieving,"4.0mm, 2.0mm, 0.5mm",NULL
"the settlement is on the western outskirts of Bad Buchau at the narrowest point between the land and the island of Buchau; since 1997, the Baden-Wurttemberg Landesdenkmalamt has led excavations there in the summer months (Billamboz et al, 2001; Hohl and Schlichtherle 2002, Schlichtherle 2004); the settlement is dated by dendrochronology to 3293-3281 BC (Schlichtherle 2004) and therefore falls in the early Horgen culture - the ceramic typology suggests a relatively occupation span; archaeobotany: Herbig (2006) notes that only 6% of the plant taxa are preserved by charring (the other 94% are waterlogged) - a majority of taxa not preserved by charring are wet-loving species (e.g. non economic plants); in the d/base I've been consistent with other sites & entered all charred remains+ waterlogged taxa (e.g. fruits&nuts etc.) which had obviously been deliberately collected & brought to the site (e.g. Corylus, Fragaria, Malus, etc.); if a taxon is preserved by charring & waterlogging the ubiquity & total no relate to the former; Herbig lists taxa present in 46 samples taken from a 20cm thick cultural layer at the site (sample by sample records not given only total/ubiquity for the 46); 211,000 plant remains, 62 plant taxa were identified (a further 22 species determination was uncertain); the author discusses the possibility of finds of 'bulgur' (e.g., fragments of grains with glossy/bulbous broken surfaces) but after consultation with Valamoti this idea is dismissed (""Accordingly, the present material is not considered as evidence of production of bulgur in Federsee during the Neolithic."" p138); the large amounts of flax remains are considered significant and in the conclusion Herbig notes: ""In Federsee area is the large amount of flax remains already a foretaste of the specialized flax agriculture settlements of the later Goldberg III-group."" [data entered in db: Herbig's tables 1-4 amalgamated]",S1180,wet-sieving,0.25mm,NULL
"F&R (p313-23) provide interim results; no details of sampling or processing were given but they note that  taxa (+charcoal) were found in most features; c.20,000 cereal grains ID & these constituted the largest % of the remains; lists of taxa not included",S1188,wet-sieving,NULL,NULL
"A Late Neolithic 'village' was excavated, consisting of more than 10 stone houses and other structures (including 'monumental' Structure 8); Archaeobotany: charred plant remains were recorded in 90 samples from houses, Structure 8 and nearby deposits. In the early stages of excavation, soil samples were rinsed in a 1.5mm-2mm sieve in the adjacent loch, and charred fragments were picked out by hand (these samples can be identified below as the samples where volume was not recorded). Subsequently, soil was processed off-site by Hinton; these samples were washed/processed with water, using a sieve of 0.5 mm mesh size (hydrogen peroxide was added to some samples to aid processing). Cereal, fruit and nut remains were recorded, including naked barley, occasional oat, hazelnut shell, crab-apple and crowberry. A wide variety of seeds, stems and tubers of other wild plants was also present, representing disturbed ground, heathland, grassland and wet places.",S1220,wet-sieving,0.5mm,NULL
"EBA: excavation of an Early Bronze Age barrow cemetery revealed evidence for funerary and ceremonial use of the complex from the earlier Neolithic to at least the Middle Bronze Age. Among the Bronze Age ring-ditches were Neolithic pits, Neolithic and Beaker flat graves, pond barrows and a linear Early Bronze Age cremation cemetery; archaeobotany EBA: Charred plant remains were recorded in 2 samples from Early Bronze Age inhumations and 4 samples from Early Bronze Age cremations. The samples were washed/processed with water, using a sieve of 0.5 mm mesh size. Most remains represent grassland taxa, but a small quantity of cereal grains was also recorded; LN: Charred plant remains were recorded in 5 samples from Late Neolithic pits at this site. The samples were washed/processed with water, using a sieve of 0.5 mm mesh size. A small quantity of cereal remains was present, including wheat. Hazelnut shell, crab-apple remains and other wild taxa were also recorded; MN: Charred plant remains were recorded in 3 samples from Middle Neolithic inhumations at this site. The samples were washed/processed with water, using a sieve of 0.5 mm mesh size. Cereals were absent, but a small quantity of crab-apple and tuber remains was present. ",S1223,wet-sieving,0.5mm,NULL
"all data recorded here are from Dietsch's unpublished thesis: the site of Bercy is located on the banks of an old river bed of the Seine and is dated to the Chasseen period (this horizon is at a level lower than that of the water tableand therefore was favorable for good preservation of by waterlogging in the alluvial layers of the Seine); Dietsch notes that she was not able to implement sampling at the site because of her late affiliation to the excavation team and so depended on samples taken earlier by Jean-Marie Pernaud; she notes that information regarding the volume of sediment sampled appeared quite sporadic on labels attached to bags containing sieved sediments and what data there was indicated that volumes sampled varied greatly (e.g., less than 2L for a sample from the square DIV 73 (CAPVAL III) and 20L for samples taken in section IV (CAPVAL III); Dietsch records taxa identified according to the different areas of the site that were sampled: Quartier Sud, CAPVAL III and CAPVAL IV; she also notes that of the 2 cultural layers distinguished in Quartier Sud most of the samples studied came from layer 2 (n=30) and only 7 derived from layer 1; CAPVAL III samples were from a bank and channel structure and CAPVAL IV samples were taken from post/stake holes and a small hearth; I have amalgamated her data from all samples recorded in tables 1, 2 and 3 [db entries replace earlier records based on Dietsch's 1996 paper]; archaeobotany: wet-sieving was possible after the establishment of a system with a permanent water supply at the site; during this first screening for the recovery of charred wood mesh sizes of 4mm and 2mm were used - then in the laboratory sieves of 2mm and 1mm were used in wet-sieving of these same samples to completely remove any remaining sediment (mention is also made of using a smaller than 1mm mesh size?); most of the plant remains were waterlogged and only a small minority were charred (e.g., cereal grains, fruitstones, acorns, hazelnuts); in the d/base I've been consistent with other sites & entered all charred remains + waterlogged taxa (e.g. fruits&nuts etc.) which had obviously been deliberately collected & brought to the site (e.g. Corylus, Fragaria, Malus, etc.); if a taxon is preserved by charring & waterlogging the ubiquity & total no relate to the former",S1272,wet-sieving,"4.0mm, 2.0mm, 1.0mm",NULL
"K (p21-23) describes remains from within the fill of a pot found in a pit; plant material was interspersed within clay lumps (3dm3) & had not charred in situ; clay was soaked in water & wet sieved",S1274,wet-sieving,NULL,NULL
"M & R-C (p69-71) record remains in a black layer (layer XIII = sand discoloured by burning) between the cairn & the sandy subsoil); c.1,000 litres were processed but numbers of samples are not given; taxa are recorded in a single list (table 1)",S1324,"machine flotation",NULL,NULL
"the site was partially excavated in 1991 by the institute of prehistory in Leiden; Brandwijk-Kerkhof is a small dune in the Dutch Rhine/Meuse river area; the excavation trench (area: 3x15m and max. depth of 6.5m) was located on the S slope of the dune where occupation was concentrated; several refuse layers were distinguished; layers 50 and 60 are the most important in extent and in terms of archaeological remains; the site was occupied periodically from c.4600-3550 BC - Swifterbant pottery was present in all layers at the site; there are indicatons that it was a temporary hunting/fishing camp in summer/winter (although all-round occupation is not discounted); archaeobotany: Out describes sampling for a/bot remains in several ways (pollen cores, sample boxes in sections, lab samples (smallest mesh 0.25mm), on-site sieving (mesh: 1.5mm) and hand-picking); I've decided to enter taxa recorded in the lab samples only: 1L samples taken from layers L50 and L60 that were sieved on a stack of sieves the smallest being 0.25mm; these samples are listed in appendix 2 under tables II.5 and II.6; 5 samples were taken from layer 50 and these are much richer than the 3 taken from layer 60; Out records waterlogged and charred remains in the same tables (the vast majority of taxa are waterlogged) - as with other sites I've entered charred remains (and noted if taxa are also found in waterlogged form) and waterlogged taxa that are known to be edible (as in PFAF) - all other waterlogged remains are omitted from db entries",S1357,wet-sieving,0.25mm,NULL
"K (p51-73) refers to 7 houses; Ph I (BbkI): 82 spls/lg pits (1668 l); 102 in sgle pits (2091 l); 21 in ext dtchs (393 l); Ph II (BbkII): 108 spls/sgle pits (2413 l); 17 in slit trchs (185 l); 7 in wall dtch (133 l); ubiquity per context type (n=3)",S1382,wet-sieving,NULL,NULL
"the dolmen of Pierre Tourneresse or Pierre Tourniresse is located a short distance from the village Cairon-Le-Vieux, 15km north of Caen; it is situated in the valley of Vey, a tributary on the right bank of the Mue - the last tributary on the right bank of the Seulles; knowledge of/work at the site dates back to the 19th century; in 1996 (following an initial survey in 1992) the first authorization to excavate was granted and work was carried out in August by 20 volunteers (authorization over three years from 1997 to 1999 was then issued so as to complete the excavation of the site); the excavation was undertaken with the aims of investigating the architecture of the monument and the palaeosol upon which the dolmen was constructed; chronology: 14C dates/artefact typology are consistent with the proposed dating to the extreme end of the middle Neolithic I or the very beginning of middle Neolithic II, in the second half of the 5th millennium; archaeobotany - there was a systematic policy of sampling implemented during the excavation of the palaeosol at the site; D-S reports in her study the analysis of seeds and fruits in 44(?not sure how this total was calculated - doesn't seem to be in agreement with tables) small samples of sediment from the palaeosol underlying the dolmen (n=38, table 15) and associated excavated structures (n=3, table 17) all samples (of 2L) were collected by the excavation team; samples were wet-sieved by the excavators on a column of two sieves with meshes of 2 mm mesh and 0.5 mm -  total volume sediment processed from the palaeosol: 86L and from the associated structures: 18L; hand-picked samples only of hazelnutshell fragments are also reported in table 16 - I haven't entered these in the db - my records refer to tables 15 and 17 in which taxa from a total of 41 samples are listed",S1421,wet-sieving,"2.0mm, 0.5mm",NULL
"J (p55-61) describes remains in 2 samples (that were reliably provenanced) taken from an in situ loam layer; no vols given - 196 was wet sieved; 165 examined in its entirety; only charred grains were recovered from the 2 samples",S1514,wet-sieving,0.5mm,NULL
"the site of Chenet des Pierres is located in the valley of the Doron de Bozel which is a major tributary of the Isere (it joins south of Moutiers); the site in an area of rockfall (?scree) at a place called the des Pierres Chenet at an altitude 940 m and oriented NW; Hippolyte Muller in 1909 reported a Neolithic site near the hamlet of Moulins Bozel- since that date it has often been mentioned but has never been studied because of the uncertainty of the location; in 1999 as part of a thematic exploration of Neo occupations in the Tarentaise valley led by PJ Rey (Rey 2006; Rey 2007a, 2007b), several surveys (S1 to S9) revealed the presence of Neolithic occupation levels in the middle of the rockfall; since 2001 one of the most promising sectors was in the S3 survey (conducted by PJ Rey) - it covers an area of about 30 m2 square between two huge blocks of schist; the site was probably seasonal but according to PJ Rey was ""a small space that was densely occupied""; 5 major sedimentary units were identified: the first 2 levels are completely reworked (level 5 is sterile), levels 3 and 4 are the archaeological sequence - evidence indicates occupation between the fourth and last third of the middle the third millennium; level 4, which includes subdivisions 4I and 4II marks the first episode of occupancy in Middle Neolithic 1; level 3, which includes subdivisions 3I, 3II and 3III indicates most recent occupation in Middle Neolithic 2; archaeobotany: sampling was carried out at the site in the 1999 season and continued from 2001 onwards (tables 5 and 6 record taxa identified in 1991 samples and post-2001 samples, respectively); levels 3 (3I & 3II) and 4 (4I & 4II) were sampled; volumes of 1999 samples range from 0.3-1.1L but much larger volumes (100L: d21) were taken in the later years); screening was performed initially at the excavation base at Bozel (d21) and the IPSA to Basel - all samples were sieved with water on three sieves 8 mm, 2 mm and 0.5 mm.; bulk samples were frozen prior to sieving in order to disaggregate sediments; all remains are charred and LM notes that preservation is quite good (although fragmentation is relatively high); in the tables  fragments have been converted to 'whole grain/seed equivalents'; I've amalgamated tables 5 and 6 for db entries",S1545,wet-sieving,"8.0mm, 2.0mm, 0.5mm",NULL
"[the site I've entered is does not have the suffix 'Sud'] at one end of the le Grand Lac (at Clairvaux-les-Lacs) on a peat peninsula J. Le Mire identified the site of la Motte-aux-Magnins in 1869; this was the first Neolithic site in a wet environment discovered in France; the depth of occupation is 1m to 2.4m; the site was successively occupied from the early 4th millennium (Burgundian Middle Neolithic) up to the middle of the 2nd millennium (end of Early Bronze Age); from 1970 to 1983 an archaeological campaign showed the importance of this major site - only 108 sq. meters have been explored out of a total surface area estimated at more than a hectare; archaeobotany: L-B reports plant remains recovered from levels IV, V and VI at the site; the main occupation level (V) is subdivided into an upper layer separated by what is described as an 'anthropogenic clay' from a lower layer; above and below level V are lacustrine chalk layers (IV and VI, respectively); it seems that a 'hiatus' marked by the anthropogenic clay represents a period when there was an influx of water that caused temporary abandonment of occupation at the site; a/bot samples were taken from four columns (dug through all levels) - the vast majority of plant remains were waterlogged; recovery was by wet-sieving and the smallest mesh sizes were 0.5mm and 0.2mm [data recorded in db are taken from table 14]; Note: a majority of taxa not preserved by charring are wet-loving species (e.g. non economic plants); in the d/base I've been consistent with other sites & entered all charred remains+ waterlogged taxa (e.g. fruits&nuts etc.) which had obviously been deliberately collected & brought to the site (e.g. Corylus, Fragaria, Malus, etc.); if a taxon is preserved by charring & waterlogging the ubiquity & total no relate to the former",S1557,wet-sieving,"0.5mm, 0.2mm",NULL
"a long timber-built Early Neolithic structure was excavated at this site (c. 24m x 8.5m). It was concluded that, while the structure may have been lived in, it was not a large 'farmhouse' and cannot be taken as a 'typical' settlement of the Early Neolithic in Scotland; Archaeobotany: Charred plant remains were recorded in 24 samples from post-holes, slot-trenches and internal pits. The samples were washed/processed with water, using a sieve of unknown mesh size. Cereal remains included emmer wheat, bread wheat and cf. 6-row hulled barley. Large quantities of hazelnut shell were recorded. The totals from C15 and C19 are >300 and >250 respectively. Crab-apple remains were also present in one deposit, as well as weeds in another deposit [hazel nut remains are present in all samples, all other taxa are only recorded in 6 samples; the 2 burnt pits contain the majority of remains]",S1559,wet-sieving,NULL,NULL
"site 1 contained a Late Mesolithic deposit of lithics and burnt material; excavation licence number: unknown.; Archaeobotany: presence only of charred and waterlogged plant remains is recorded in one sample; the method of recovery is unknown. Note from SC: as with other sites I've entered charred remains (and noted if taxa are also found in waterlogged form) and waterlogged taxa that are known to be edible (as in PFAF) - all other waterlogged remains are omitted from db entries",S1563,NULL,NULL,NULL
