Notes,SiteID,RecoveryMethod,MeshSize,RecoveryMethodNotes
"Si2: the pile dwelling construction Sipplingen at Uberlingen Lake is one of the standard Neusiedel stations on Lake Constance (all refs from Riehl online publication); the samples described were taken during under-water excavations (dir: Monuments Office of Baden-Wuerttemberg) in the years 1998 and 1999; all samples described here are from the Pfyn culture layers (Jacomet has published Horgen dated layers); to investigate the Pfyn settlement an area of 38 m2 was excavated; the upper cultural layer (layer 9, findings 2.1-2.5) dates back to 3700 BC - sampling was carried in m2 over the entire excavation area; layer 9 contained a burnt layer (finding 2.4) - the focus of archaeobotanical studies; below this: (layers 7 and 8, findings 4.1-4.4.6 / 5) dated by dendro to 38C BC - only partially excavated and sampled to a lesser extent (detailed information on layers sampled given in translation); archaeobotany: the basis of archaeobotanical investigations were 18 columns taken from profiles (location of profiles in the excavation area, see Figure 4-6, Appendix 6); additional samples were examined from the 9cm thick burnt layer (find 2.4; see translation for full description); different size fractions were sorted: > 0.2 mm > 0.5 mm > 1mm > 2mm and > 5 mm, all of which were processed: > 5 mm > 2 mm and most of the > 1 mm were fully processed but only 10% of the fraction > 0.2 mm was processed due to time constraints; mean total density of the Pfyn remains (charred and uncharred) is more than 4,400 items per litre; [full descriptions of taxa given in the pdf - also results of analyses including CA]Si1: Horgan dated levels were uncovered in the eastern harbour area (Jacomet analysed the plant remains from this period); a profile column sample was taken through the 1m thick cultural deposits - 5 major cultural levels (levels 11-15) were defined (subdivisions within these are listed on p300); dendro dates indicated that the Horgen settlement lasted nearly 500 years; 19 samples (coincidental with the 19 stratigraphic subdivisions) were taken from the profile column (sample volumes varied between 200-3000cm3); plant remains were recovered by wet sieving using meshes of 8,4,2,1,0.5mm; samples contained charred and uncharred/waterlogged specimens - a majority of taxa were waterlogged (sample 10 is equivalent to the burnt layer 10 and has the highest numbers of charred specimens); the later Horgen (upper levels from layer 11 and above) has a more diverse range of species; together with the taxa previously identified by Bertsch (1932) the total number of species/genera/families represented is 163; quantititative data entered in db are from tables 4-7 - several 'economic' taxa are not listed in these tables but are noted in table 3 and for these presence only is entered in dbNote: a majority of taxa not preserved by charring are wet-loving species (e.g. non economic plants); in the d/base I've been consistent with other sites & entered all charred remains + waterlogged taxa (e.g. fruits&nuts etc.) which had obviously been deliberately collected & brought to the site (e.g. Corylus, Fragaria, Malus, etc.); if a taxon is preserved by charring & waterlogging the ubiquity & total no relate to the former",S6088,wet-sieving,"8.0mm, 4.0mm, 2.0mm, 1.0mm, 0.5mm, 0.2mm",NULL
"the settlement was in the loess area between the valleys of the Danube River and the Isar River near the mouth of the Isar; Kuster records that he received samples from the director of the excavations (Dr K. Schmotz)",S6104,NULL,NULL,NULL
"the site is located about 2 km NNE of the village ""Riedwiesen"" in a bay-shaped basin, upstream of the western flank of the northern Rieder; the preservation of finds in the interior of the cultural layers is excellent (all preserved in peat/waterlogged layers; Koninger & Schlichterle 2004); after initial test soundings in drainage ditches in 1984 full scale excavations took place in 1992/3 and 2 sections of buildings - houses 1 and 2 were exposed in a total of 127 m2; house 1 comprises a total of 8 wooden floors and also has a courtyard in which is a domed oven; timber components made of oak and beech, especially from the lower floor layers 2 and 3 of house 1 revealed a dendrochronological dates: 3920-3916 BC (Billamboz 1998, 165); in addition, is a 14C date of oak flooring: 5345 ± 30BP HD 9509-9275, 4315-4046 cal BC; archaeobotany:  a total of 39 sediment samples were examined, of which 15 are from house 1, five from the ""Gasse/alley"" and 19 from different parts of house 2; the sample size varied between 30 cc and 1.2 litres, the average sample size was approximately 300 cc. (a total of nearly 12 litres of sediment was analysed); samples were washed on a set of sieves (mesh sizes: 8, 4, 2, 1, 0.5 and 0.25 mm) - all were rich in waterlogged and charred plant materials (all listed in table 1);  a majority of taxa not preserved by charring are wet-loving species (e.g. non economic plants); in the d/base I've been consistent with other sites & entered all charred remains+waterlogged taxa (e.g. fruits&nuts etc.) which had obviously been deliberately collected & brought to the site (e.g. Corylus, Fragaria, Malus, etc.); if a taxon is preserved by charring & waterlogging the ubiquity & total no relate to the former ",S6150,wet-sieving,"8.0mm, 4.0mm, 2.0mm, 1.0mm, 0.5mm, 0.25mm",NULL
"the site is in the southwest of Germany, about 50 km north of Lake Constance, only 15 km south of the Danube; it was rediscovered only during of archaeological soundings of the settlement by the State Office for Historical Monuments of Baden-Wurttemberg and joined by the staff of the research program ""Project Lake Constance, Upper Swabia""; numerous boreholes in the relevant area were carried out on a 10m grid; within an area of about 2000-3000 square meters there was an estimated ten to thirty house plans; the settlement was uncovered along a 60 metre long narrow cut through drainage ditch section at a depth of about 2 m - in the central settlement area of this transect were four houses with screeds, wood floors and fireplaces; archaeobotany: in July 1982 at different locations a total of ten columns and eight individual profile samples were taken: the removal of the cultural layers was carried out continuously from the top down to the underlying peat by the removal of individual layers (e.g. charcoal layer, clay lens, etc.); in the area of peats and muds whole sections were taken from box samples in the profile wall; in 1981 Maier took 112 individual samples (Chapter 6) from mud-peat profile (E 1); samples from culture layer material were depending on the crumbliness of the sediment, soaked in water for a short time or several hours; as a rule, then the samples had decomposed so much that they could be washed/separated easily; all samples are separated by a washing through a set of three sieves with mesh sizes 2.5, 1.0, 0.3mm (if a taxon is preserved by charring & waterlogging the ubiquity & total no relate to the former; if not stated items are uncharred); profile samples (1982): no single table includes all economic and wild taxa - therefore I've had to amalgamate totals/ubiquities from several lists/figures/sections of text (i.e., there could be inaccuracies) and wild (?potentially economic taxa) not included in section 3.2 have not been entered in the db; coprolites: there is a separate table for contents of coprolites but these have not entered in db [both sets of samples (profile and individual) are described separately - comments are made throughout about the relative amounts of charred versus waterlogged taxa]; data entered in db: charred and uncharred cereal remains from the occupation layer profiles (also including: ubiquities for certain economic taxa taken from figure 14; lists of taxa from section 3.2.2 (p190-192)[e.g., table 6]",S6151,wet-sieving,"2.5mm, 1.0mm, 0.3mm",NULL
"the site (located at the W end of Lake Constance) was discovered in 1866 and excavated in 1982-4/86; the EBA pile-dwelling site is situated 120-160m from the shore and in area covers 70x40m; 3 cultural layers (BsIA, IB, IC) are described - all interleaved with limnic chalk and fluviatile deposits (the lower layer is dated to the older EBA and the upper layers to the recent/later EBA); a 6cm thick burnt layer (see abot notes below) was identified in the lower layer; thre present study relates to all three EBA cultural layers (see figure 6, p447 for stratigraphy and location of profile samples Q62/2, Q62/4, Q62/6); archaeobotany: profile samples (Q62/2/4/6) taken from cultural layers and surface samples ('Flachenproben') were examined; samples were wet-sieved on a stack of sieves (5, 2.5, 1, 3.15, 0.2mm) - a majority of the plant remains from the profile samples were waterlogged and additional charred cereal taxa are recorded from 5 of the 'Flachenproben' which included the burnt deposit in the lowest cultural layer (tables 3 and 6; see ch3, pp:450-453); db entries are for taxa from the 3 profile samples recorded in table 16 - including notes on additional charred cereal grains and chaff listed in tables 3 and 6; Note: a majority of taxa not preserved by charring are wet-loving species (e.g. non economic plants); in the d/base I've been consistent with other sites & entered all charred remains + waterlogged taxa (e.g. fruits&nuts etc.) which had obviously been deliberately collected & brought to the site (e.g. Corylus, Fragaria, Malus, etc.); if a taxon is preserved by charring & waterlogging the ubiquity & total no relate to the former",S6153,wet-sieving,"5.0mm, 2.5mm, 1.0mm, 0.315mm, 0.2mm",NULL
"a Late Neolithic settlement containing Grooved Ware was excavated at this site between 1976-9, probably associated with the Dorset Cursus which is only 140m SE; 16 pits were discovered; the LN site is overlain by an MBA three-sided rectilinear enclosure (SU 01 SW 84) containing 5 circular huts and a long rectanguilar building; Archaeobotany: a total of 68 samples from 15 Neolithic pits were examined for their archaeobotanical content; charred plant remains were recorded in an unknown number of samples from 9 pits; samples from the other 6 pits did not contain plant remains; the method by which the soil samples were processed is unrecorded; a small quantity of remains was present, including naked barley, hexaploid wheat, hazelnut shell, crab-apple.",S6334,NULL,NULL,NULL
"extensive middens of Beaker date were excavated in a soft machair environment, beneath which was discovered an old land surface containing traces of plough and spade agriculture; Archaeobotany: charred plant remains were recorded in an unknown number of samples; the samples were washed/processed with water, using a sieve of unknown mm mesh size; grains of naked barley were predominant, with some evidence of hulled barley and emmer wheat also recorded; at least some of the barley was of the six-row variety.",S6580,wet-sieving,NULL,NULL
"area 2 contained three Early Neolithic rectangular structures and a series of pits, some of which were interpreted as ritual pits; later activity in Area 2 included Early Bronze Age campsites and Middle Bronze Age ring-ditches; a Late Neolithic pit complex was also recorded in nearby Area 1, while burnt mounds were found in Area 4; excavation licence number: AE/04/77.; Archaeobotany: charred plant remains were recorded in five soil samples from Early Neolithic deposits associated with the structures (C58, C59, C358, C367, C466); the samples were washed/processed with water, using a sieve of unknown mesh size; cereal grains (including cf. naked wheat, cf. naked barley and cf. common oat), hazelnut shell and a weed were present; seed/grain impressions were also recorded on ceramic sherds from the following deposits: C58, C368, C376, C378, C426, C578, C598); the impressions were identified as cf. wheat, crab-apple and sloe. NOTE FROM MERIEL MCCLATCHIE: Be cautious about the quoted cereal identifications, given the absence of chaff.",S6751,wet-sieving,NULL,NULL
"a Middle Neolithic pit complex (consisting of three groups of pits) was recorded at this site; evidence for other prehistoric and later activity was also present, including a Bronze Age cremation cemetery, Iron Age cremations and post-medieval agricultural activity; excavation licence number: E2610.; Archaeobotany: three soil samples from pit fills contained charred plant remains; the samples were washed/processed with water, using a sieve of 0.25 mm mesh size; hazelnut shell, hulled barley grains and indeterminate cereal grains were present; exact counts of material were not provided (instead recorded as rare=1-5/occasional=6-10/common=11-50/abundant=>50).",S6760,wet-sieving,0.25mm,NULL
"Caherabbey Upper, Co. Tipperary, Ireland: Site 189.1 (Area 1) contained an Early Neolithic possible structure; beaker pottery was also found nearby; excavation licence number: E2298, A035/000.; Archaeobotany: three soil samples were taken from deposits associated with the possible structure, all of which contained charred plant remains; the samples were washed/processed with water, using a sieve of 0.25 mm mesh size; several hundred cereal grains were recorded, including cf. emmer wheat; hazelnut shell and weed remains were also present.",S6840,wet-sieving,0.25mm,NULL
"an Early Bronze Age pit burial was located near the burial cairn at this site. Early-Middle Bronze Age cist burials were recorded beneath the burial cairn; excavation licence number: unknown.; archaeobotany: charred plant remains were recorded in three samples from the Early Bronze Age pit burial at the site; two of the samples (S27 and S28) were washed/processed with water, using a sieve of 0.25 mm mesh size; the plant remains from S25 were hand-picked; cereal remains (including cf. emmer wheat, cf. spelt wheat and cf. barley), hazelnut shell and weeds were present.",S6862,"wet-sieving, hand-picked",0.25mm,NULL
"Early Neolithic: Site 1 was located at the edge of a raised bog and contained a complex of five Early Neolithic burnt mounds, which produced numerous deliberate deposits of marl mixed with burnt flint, bone and pottery; a Late Mesolithic fishing platform, mooring and four conical fish-traps were also located at this site. Excavation licence number: E3064, A008/011.; Archaeobotany: charred and waterlogged plant remains were recorded in 55 deposits, most of which were associated with burnt mounds at the site; the samples were washed/processed with water (sieve size unknown); a wide range and large quantity of plants remains were recorded, including cultivated crops.; note from SC: as with other sites I've entered charred remains (and noted if taxa are also found in waterlogged form) and waterlogged taxa that are known to be edible (as in PFAF) - all other waterlogged remains are omitted from db entries;Late Mesolithic: Site 1 was located at the edge of a raised bog and contained a Late Mesolithic fishing platform, mooring and four conical fish-traps; a complex of Early Neolithic burnt mounds was also located at this site; excavation licence number: E3064, A008/011.; Archaeobotany: charred and waterlogged plant remains were recorded in 15 deposits, which were associated with layers, a wooden platform and fish-traps at the site; the samples were washed/processed with water (sieve size unknown); a wide range and large quantity of plants remains was recorded, including cultivated crops (these crops are likely to be contaminants, deriving from Early Neolithic activity at the same location; Note from SC: I've excluded these taxa from db entries).; Note from SC: as with other sites I've entered charred remains (and noted if taxa are also found in waterlogged form) and waterlogged taxa that are known to be edible (as in PFAF) - all other waterlogged remains are omitted from db entries",S6914,wet-sieving,NULL,NULL
"an Early Bronze Age 'temporary' settlement was recorded, consisting of a shell midden, hearths and pits; excavation licence number: 92E0185 and 94E128.; Archaeobotany: Charred plant remains were recorded in 12 samples from Early Bronze Age activity at the site; the samples were washed/processed with water, using a sieve of unknown mesh size. Cereal grains (including cf. emmer wheat and hulled barley) and weed seeds were present; the analysis was carried out by David Weir (Weir 1996) and Gill Plunkett (pers. comm.).",S7006,wet-sieving,NULL,NULL
"Site 1 contained an Early Bronze Age pit and stake-hole; an Early Neolithic rectangular structure and post-medieval activity were also present nearby; excavation licence number: E2119, A014/003.; Archaeobotany EBA: three soil samples from the pit were found to contain charred plant remains; the deposits were washed/processed with water, using a sieve of 0.25 mm mesh size. Small quantities of cereal remains (including emmer wheat and barley), possible flax, hazelnut shell, possible crab-apple and weed remains were recorded.; EN: eight soil samples from deposits associated with the house were found to contain charred plant remains; the deposits were washed/processed with water, using a sieve of 0.25 mm mesh size; small quantities of cereal remains (including emmer wheat and barley), hazelnut shell, crab-apple and weed remains were recorded; exact counts of crab-apple endocarp fragments were not provided.",S7030,wet-sieving,0.25mm,NULL
"Site 27 contained two Early Neolithic rectangular houses; later activity was also recorded at this site, including Bronze Age pits and burnt mound material, as well as later pits; excavation licence number: 04E0548.; Archaeobotany: twenty-one soil samples from deposits associated with the two houses contained charred plant remains; the samples were washed/processed with water, using a sieve of 0.25 mm mesh size; hazelnut shell and cereal remains (including naked barley, emmer wheat and oat) were present; exact counts of material were not provided in many cases (instead recorded as rare=1-5/occasional=6-10/common=11-50/abundant=>50).",S7037,wet-sieving,0.25mm,NULL
"Sites 11 and 12 each contained an Early Neolithic pit complex, which appear to be contemporary;an Early Bronze Age burnt mound with troughs was located nearby; excavation licence number: AE/02/76.; Archaeobotany: fourteen samples associated with the two pit complexes contained charred plant remains; the samples were washed/processed with water, using a sieve of 0.25 mm mesh size; large quantities of hazelnut shell were present, as well as smaller quantities of wheat grains, naked barley grains and other seeds",S7038,wet-sieving,0.25mm,NULL
"Sites 3 and 5 each contained a Middle Neolithic pit complex; later activity was also located at this site, including a Bronze Age pennanular ring ditch, Iron Age gullies, ard-marks and early medieval pits; excavation licence number: 02E0606.; Archaeobotany: charred plant remains were recorded in seven samples from Middle Neolithic pits at the site; the samples were washed/processed with water, using a sieve of 0.25 mm mesh size; large quantities of hazelnut shell were present, as well as smaller quantities of cereal remains (including barley and cf. emmer wheat).",S7061,wet-sieving,0.25mm,NULL
"Early Bronze Age pits and layers were located at this site; extensive activity dating to other periods was also found, including an Early Neolithic rectangular house, a later Bronze Age structure, Iron Age deposits and later features; excavation licence number: 03E0306.; Archaeobotany: charred plant remains were recorded in 16 samples associated with Early Bronze Age layers and pits; the samples were washed/processed with water, using a sieve of 0.30 mm mesh size; cereal grains (barley), nut and fruit remains were present.",S7067,wet-sieving,0.3mm,NULL
"this site straddles three townlands (Kilsheelan, Poulakerry and Cloghcarigeen East). Areas 1 and 2 contained Middle Neolithic pit complexes; later activity was also located at this site, possibly related to modern field clearance; excavation licence number: 05E1391.; Archaeobotany: charred plant remains were recorded in five samples from Middle Neolithic pits at the site; the samples were washed/processed with water, using a sieve of 0.25 mm mesh size; cereal grains (including emmer wheat), hazelnut shell and a weed were present.",S7091,wet-sieving,0.25mm,NULL
"Sites 2b and 2c (two adjacent excavations) contained a single Early Neolithic causewayed enclosure; the dating of this site has been subject to some controversy. While a number of charcoal radiocarbon dates appear to fit into the period 4000-3800 cal BC, Whittle et al. are not convinced by them, and instead suggest that the site is more likely to date to sometime after 3800 cal BC; later activity included an Iron Age circular structure (Site 2c) and an early medieval enclosure (Site 2b). Excavation licence number: 03E0536 (Site 2b) and 03E0538 (Site 2c).; Archaeobotany: charred plant remains were recorded in 22 samples from Early Neolithic interior pits and other features at the causewayed enclosure; the samples were washed/processed with water, using a sieve of 0.50 mm mesh size; cereal grains (including wheat and barley) and hazelnut shell were present; exact quantities of remains were not recorded in many cases.",S7138,wet-sieving,0.5mm,NULL
"Site 1 contained three Early Neolithic rectangular structures, as well as associated pits and hearths; later activity was also recorded at this site, including a Bronze Age burnt mound and pits, an early medieval drying kiln, a medieval burial and post-medieval agricultural features; excavation licence number: 03E0888.; Archaeobotany: charred plant remains were recorded in 62 deposits from Early Neolithic structural and related features; the plant remains derived from forty-eight soil samples, which were washed/processed with water using a sieve of 0.25 mm mesh size; hazelnut shell was also hand-picked during the excavation from the following 14 deposits: C62, C445, C450, C482, C499, C562, C601, C603, C605, C630, C673, C906, C925, C1054; cereal remains (including emmer wheat and naked barley), hazelnut shell and weeds were present; exact counts of material were not provided in many cases (instead recorded as rare=1-5/occasional=6-10/common=11-50/abundant=>50); an oat grain from C4 was 14C dated to the post-medieval/modern period, and it is therefore unclear if other oat grains from these deposits are Neolithic or later.",S7154,"wet-sieving, hand-picked",0.25mm,NULL
"Site 37 contained an Early Neolithic rectangular structure; Late Mesolithic hazelnut shell had also become incorporated into a slot-trench of the structure (reported in file ""Newrath_37_LMeso""); later activity at this site included an Early Bronze Age cist burial (surrounded by a ring-ditch) and a Middle Bronze Age pit cremation cemetery; excavation licence number: 04E0288.; Archaeobotany: charred plant remains were recorded in two samples associated with the Early Neolithic house; the samples were washed/processed with water, using a sieve of 0.25 mm mesh size; hazelnut shell, emmer wheat remains and other seeds were present; exact counts of material were not provided (instead recorded as rare=1-5/occasional=6-10/common=11-50/abundant=>50). [Note from SC: all taxa are rare]",S7177,wet-sieving,0.25mm,NULL
"part of an Early Neolithic rectangular structure was excavated at this site; excavation licence number: E0374.; Archaeobotany: charred plant remains were recorded in seven samples from deposits associated with the Early Neolithic house; the samples were washed/processed with water, using a sieve of 0.30 mm mesh size; cereal grains (including cf. emmer wheat), hazelnut shell and crab-apple were present.",S7189,wet-sieving,0.3mm,NULL
"an Early Bronze Age pit complex was recorded at this site, which was interpreted as representing possible ritual activity; an Early Neolithic rectangular structure was also present, while later activity included a Middle Bronze Age pit burial, a medieval enclosure, post-medieval ditches and undated metal-working; excavation licence number: E2571, A021/013, A021/014.; Archaeobotany EBA: charred plant remains were recorded in two samples from Early Bronze Age pits at this site; the samples were washed/processed with water, using a sieve of 0.25 mm mesh size; cereal grains (including emmer wheat and naked barley) were present; exact counts of material were not provided (instead recorded as rare=1-5/occasional=6-10/common=11-50/abundant=>50). [Note from SC: all taxa are rare]; Archaeobotany EN: charred plant remains were recorded in six samples from the Early Neolithic structure at the site; the samples were washed/processed with water, using a sieve of 0.25 mm mesh size; cereal grains (including emmer wheat) and hazelnut shell were present; exact counts of material were not provided (instead recorded as rare=1-5/occasional=6-10/common=11-50/abundant=>50).",S7221,wet-sieving,0.25mm,NULL
