Notes,SiteID,RecoveryMethod,MeshSize,RecoveryMethodNotes
"the site is located in Djursland - E Jutland; Robinson notes that in the region large portions of the Neolithic and BA landscape with remains of houses and fields are preserved under thick layers of drift sand (more details are given in Boas 1997); he states that drift sand is thought to have been caused by human actions and in severe cases has led to the abandonment of fields and houses; a series of aisled houses were excavated in the Hemmed Plantation and Hemmed Church sites; archaeobotany: analyses of the late Neolithic occupations at the Plantation site were based on samples from House III (A200) - a 2-aisled house dated to c.2200BC (Single Grave Culture) and House I (A40) - a 2-aisled house dated to c.1800BC (Bell Beaker); EBA samples were from House II - a 3-aisled house dated to c.1300-1400BC; Robinson lists numbers of charred taxa per phase (presumably amalgamated totals for several samples in each phase) but not ubiquity; in Henriksen's 2000 NNU report he notes that flotation done at Djursland museum was on a 1mm mesh and that additional material floated in the NNU on a 0.5mm mesh did not significantly add to the numbers of small seeded taxa recovered [additional taxa added from Henriksen's 2000 NNU report]",S7950,flotation,"1.0mm, 0.5mm",NULL
"the site is located in the N of Fyn island - c.2km S of Bogense; it apparently covers most of a low c.3000m2 sandy rise surrounded by boggy ground; a series of postholes define what the excavator has interpreted as a structure/house which was apparently burnt to the ground (hence the large sample of charred grain recovered by the excavator represents the remains of a burnt cereal store - mainly covering the NW part of the house); a concentration of loom weights was also found; pits are located near to the structure - they had steep sides and were c.90cm deep; archaeobotany: RC notes that a very large sample of charred grain (33L; described by the excavator: 'cereal grains in such enormous quantities that they could literally be recovered by the shovel-full') was collected by the excavator Anders Jaeger using flotation but the specimens he describes in his report are from samples he took and processed using froth flotation (no mention of sieve sizes); he sampled the main house structure and two pits (1 and 2); all plant remains are charred; the cereal grains are recorded in figure 1 and descriptions of weed seeds and cereal chaff are taken from the text",S8047,"froth flotation",NULL,NULL
"the site is located c. 1km south of Mortens Sande 2 (on the N Sea coast N of Limfjorden between Agger and Stenbjerg); the LNeo settlement would have been located between 3-5km from the coast; the site was excavated by Liversage in the 1980s/90s and was found to comprise 2 settlement layers (each composed of several smaller layers) and separated by c.1m layer of shifting sand; much of the site is below the dunes and so excavation is prevented; post-holes showing the settlement plan are visible; in the lowest settlement layer (A) ceramics of typical Bell Beaker style were found (dated to: 3539<U+00B1>85 bp (uncal) (K-3536) and 3720<U+00B1>85 bp (K-3537)); the upper layer (C) has artefacts characteristic of the late-Late Neolithic; charred plant remains are found in the lower settlement layer (with the exception of very few in sample 10 from layer C - not reported here); archaeobotany: 4 samples were taken from the lowest level in A: 1, 8, 14, 15, and 5 from the upper level: 13, 3, 5, 6, 12 (a layer of shifting sand separates the two levels); sample size is recorded as 20L; bucket flotation was carried out by the excavator using a 'tightly woven fabric' to catch the fine fractions; both charred and uncharred remains were found in the samples and Robinson notes that because most taxa are found in charred and uncharred form that the latter are presumably contemporaneous with the settlement; the list below is a combination of the tables in Robinson's 1992 and 2003 reports - only fruits (Rubus spp.) found in uncharred form and listed in the 1992 report are entered in the db [in the 1992 report Robinson reports burnt fragments of what seem to be bread - or possibly human faeces]",S8054,"bucket flotation",NULL,"mesh size: excavator refers to a 'tightly woven fabric'"
"the site is on the coast located in wind blown sand and was revealed by coastal erosion; it was excavated extensively and structures were uncovered - there were remains of 3/4 consecutive structures (interpreted as shelters) each with a post and a double row of stakes (amber, flint and pottery assemblages were well sealed in the occupation deposits); archaeobotany: samples came from stratum 0 the same level as structural remains with a date of 2110<U+00B1>85 bc; samples were taken from internal and external cultural layers and from a pit associated with the structure; processing was done by the excavator using  manual flotation or sieving; the mesh size used in flotation is described as being ""so small that it is very unlikely that any seeds were lost""; sieved samples were processed with a 0.8mm mesh and then agitated in water (this method recovered larger pieces of charcoal and some cereal grains); full lists (which are in agreement with the list published by Robinson in 2003) are taken from Robinson and Kempfner 1987 (all remains are charred, with the exception of one record for an impression)											",S8081,"bucket flotation, wet-sieving",0.8mm,"mesh sizes listed for wet-sieving only; flotation: mesh size recorded as very smalll"
"the site is on the NE coast of Bornholm in Osterlarsker parish (excavated by C.J. Becker); the charred plant remains were from 2 shallow pits (311, 399); Helbaek (1958) notes that the 2 pits were dug into subsoil and over which a stone cover was placed that was associated with the EBA funerary monument; Becker's descriptions of the pits as follows: 'pit 399 was found in square 28, it measured 50x40cm at the top but was only 9cm deep... It was full of grey sand, in which the charred remains of apples, etc. lay scattered from top to bottom. The pit contained no stones, flint waste or potsherds and only very little charcoal. On a level with its upper edge and within about 3m on either side were scattered habitation remains.... A vital factor in the dating of pit 399 was the circumstance that it was covered completely by a stone pavement which at spots was undisturbed and proved to be a remnant of a [EBA] tumulus about 16m wide"" and pit 311: ""was found in square 17 (c.20m N of pit 399). It consisted of a small, irregular excavation in the yellow sand of the substratum. Its boundaries were not difinable, but the depth was c.25cm.""; dating ambiguous but Robinson 2003 lists the site under Late Neolithic/Bell Beaker culture [previous db entry lists it under Battle Axe culture]; archaeobotany: large charred remains were picked out by hand and the remaining contents of the pits were bagged and submitted to the author (?no mention of whether the bulk samples were sieved or not); most numerous were the wild apples - which he assumes were accidentally burnt whilst being dried to preserve them (in 1952 plate II/1958 fig. 1 most of the apples appear to be cut in half); all burnt plant debris is assumed to have been deposited as waste from drying/cooking events; pit 399 has more remains than 311 - Helbaek records that the former has more than 2L of ""assorted plant parts""; he notes that all the plant remains were covered with a thin coating of ash that hindered identification to some extent (e.g., of the 40 weed seeds it was possible to distinguish only a few)",S8095,"hand-picked, wet-sieving/dry-sieving",NULL,NULL
"the settlement (a 'kitchen-midden' site) is located on the prehistoric shore of Skanderborg lake in E Jutland; it is at the foot of a 3-4m high SW facing hillside; in 1969 drainage work in the bog adjacent to the settlement exposed large quantities of Ertebolle - a test excavation folowed and revealed a 20-80cm thick 'waste layer' or 'dump zone' of discarded materials in the prehistoric lake sediments (=present day bog); from 1969-85 the excavations were extensive and exposed a settlement area on dry land with a large number of structural remains such as pits, hearths, trenches and post-holes, and an adjacent 'dump zone' in the prehistoric lake in front of the settlement site with thousands of animal bones and artefacts of organic materials (the settlement covers the Mesolithic-Neolithic transition and the whole Ertebolle period); from 1969-1980 work concentrated on the the midden/dump zone and in the following years the settlement area was exposed; the settlement area is c. 3000m2 and the adjacent dump/midden zone is c. 1800m2; due to soil erosion the habitation area on dry land was covered with sandy-humus and only a small area had been disturbed by ploughing; below the eroded sediments was a 20cm thick in situ occupation horizon - the top layer was charcoal-rich and contained many cooking stones and flint debris; in the cultural layer below this there were stone hearths, fireplaces, stake and post-holes, charcoal patches and various pits (no clearly defined house structures were found); the faunal remains are indicative of a seasonal (winter) site occupied from autumn to early spring; archaeobotany: in their 2002 paper Robinson & Harild list the plant taxa identified by Jorgensen (1974 unpublished report NNU A5502 Danish National Museum) - no other details are provided about recovery, etc.; R&H state: 'J analysed samples from a culture layer in peat and gytta deposits' - I assume therefore that the samples (total 18) were taken from the midden/dump zone where preservation was likely by waterlogging - so all db entries are for waterlogged taxa [totals for all specimens in the 18 samples have been amalgamated in one list in R&H table 7.1]",S8112,NULL,NULL,NULL
"between 1978 and 1984 the large settlement at Spodsbjerg was investigated by the Langeland museum; the site runs along the base of a 9m high bank that extends out into a meadow - formed by the overgrowing/silting up of a lagoon; on the shore (presumably former shore-line) there are flints and ceramics but in the humid lake deposits to the SE there is remarkably well-preserved organic material - including wood, bone, antler and plant remains; archaeobotany: during the exavation samples were taken by the excavator (Jens Bech) from profiles through cultural layers and from a large waste pit; a total of 13 samples, six from profile XXXVI (Fig. 2 & 3), four from the pit BAD and three from the Profile II - it was found that seven samples were fit for purpose and the analyses of these samples are discussed by RB&H; size of samples ranged from 0.25L to over 4L but subsamples were examined (c.200-310ml) because the sorting process was so time consuming; the authors note that the subsamples were soaked in water for about a day before wet-sieving on meshes of 0.5mm and 0.25mm [RB&H also record burnt 'bread-like' crust in profile II sample]; Note: a majority of taxa not preserved by charring are wet-loving species (e.g. non economic plants); in the d/base I've been consistent with other sites & entered all charred remains+ waterlogged taxa (e.g. fruits&nuts etc.) which had obviously been deliberately collected & brought to the site (e.g. Corylus, Fragaria, Malus, etc.); if a taxon is preserved by charring & waterlogging the ubiquity & total no relate to the former",S8158,wet-sieving,"0.5mm, 0.25mm",NULL
"Robinson provides no information other than this an extensive kitchen midden site on Mariager Fjord in N Jutland (his full report is as yet unpublished apparently - see biblio in Robinson 2007); he records that small quantities of charred plant remains were found associated with hearths within the kitchen midden deposits; he lists in summary form the taxa (with totals and number of samples in which the taxa were found) recovered and identified after 400L of hearth deposits were processed; he notes that the state of preservation of grains (etc.) was poor",S8217,NULL,NULL,NULL
"the site is located in C Jutland; it was dug between 1974 and 1977 (by the National Museum) - a total of 80,000m2 was excavated; the remains of a large Single Grave culture settlement were unearthed located on the northern slope of a small elevated plain; the cultural layer was immediately under the soil horizon - noticeable because the flecks of charcoal and charred seeds; the floor layer measures 4x4m and is 10-15cm deep - the area is circumscribed by a row of post-holes (and largely undisturbed by later occupations); the entire deposit as well as the fillls of the post-holes was sieved through a 1.5mm mesh; the house would have measured c.5x6m - at the E end there was a hearth; archaeobotany: all charred plant remains were recovered by (?dry-)sieving with a 1.5mm mesh; there were concentrations of burnt remains in the culture layer and in/around the hearth (see fig. 1 in Jorgensen for distribution of remains)",S8220,dry-sieving,1.5mm,NULL
"the site is on the NW coast of Fyn island; in the late Mesolithic the settlement was located on a shoreline of a protected cove or shallow/brackish lagoon; today the site is 250m from the present shoreline and is c.3m below sea level; it was excavated between 1978-1987 by Soren Anderson of the University of Aarhus; the waterlogged remains provided evidence of inshore fishing activities with extensive settlement refuse (e.g., fish traps, hooks, dug out canoes, paddles); there are two main phases of occupation: the lower belongs to the aceramic early Ertebolle (5600-4750 calBC); and the upper dates to the ceramic late Ertebolle from 4750 calBC; archaeobotany: all a/bot samples were taken during the underwater excavations and are from the settlement refuse layer (c.20cm thick) associated with the late Ertebolle period; the plant remains (both charred and waterlogged) were recovered by wet sieving on meshes of 2, 1, 0.5mm diameter; 21 samples were analysed and are of two types: 1) large samples with a volume of 7-16 L; and 2) smaller samples of 0.8-3 L volume; total volume examined was 85 L and 46 taxa were identified (not all listed in the 1999 report); Kubiak-Martens records total number of specimens in the 21 samples but not ubiquity",S8443,wet-sieving,"2.0mm, 1.0mm, 0.5mm",NULL
"the pile-dwelling site is located on the N bank of the Gnadensees - approximately midway along the 2km stretch of the shore between the headlands of the Allensbach Muhlenbachmundung and the 'Nachtwaid' of Hegne (the site is submerged beneath the present lake level); old reports subsume the site with two others (Allensbach-Strandbad and Hegne Nachtwaid); in February 1983 when the lake was covered in ice it was possible to sink boreholes (each 5cm in diameter) down into the cultural deposits along three transects (A-C - see Schlichtherle fig 1); 2 dendro dates on timbers from the site (2672 and 2681 BC) place it within the Corded Ware culture (consistent with other sites in the Lake Constance area); archaeobotany: samples were taken from the boreholes for pollen analyses and to investigate preserved macro-remains; 13 samples from several boreholes were examined for macroremains - no details are provided on recovery methods used; as far as I can ascertain all taxa except one (a hulled barley grain) are waterlogged (and including mosses, twigs, bud scales, etc.); only cultivated and collected plant taxa are entered in db (e.g., cereals, fruits, nuts, possible herbs, etc.); Rosch mentions the possibility of some mixing of the cultural layer with the overlying/underlying limnic chalk deposits - I haven't translated this section fully",S8458,NULL,NULL,NULL
"the site is on a calcareous spur between two valleys - it dominates the current course of the Vendee; the exceptional situation being within reach of a marshy alluvial plain and on a calcareous plateau attracted the first farmers at c. 4000 BC; in the middle Neolithic hearths and activity zones were uncovered in houses clustered together to form a compact 'village' ( http://www.gvep.fr/sites_vendee/auzay/auzay.htm); archaeobotany: all records are taken from Marinval's db (pers.comm) - charred plant remains were recovered by flotation (no further details are given); taxa from 3 samples are recorded (samples from: layers 1173, 1174, 1175, locus 3 in squares 46-47, levels 455-465) - volumes floated are given",S8508,flotation,NULL,NULL
"Darion-Colia is a late Rubane fortified village in Hesbaye Liege (Geer, Prov. Liege, Belgium) excavations took place between 1981 and 1985; the whole site was destroyed to make way for two settling tanks of wastewater from a local sugar factory, which led to emergency excavations in 1989; located on a ridge of low relief occupying the interfluve between Geer and its first tributary the Neolithic occupation extends north and west of the crest of the ridge and on the southeast slope to the Faux Geer; it is a small village in an area of a little less than 2 ha bounded by a discontinuous ditch lined internally by a fence and crossed by four major openings carefully defended by an elaborate system of fences, some of which are staggered; 7 houses are confined to the southern part of the area, including four that retain the majority of poles and three others were identified by alignment of some posts; one of the houses partially preserved (M7) is outside the enclosure near the south entrance; thee houses, maybe four, have a trapezoidal plan (M2, M3, M4, M6 optionally); alignment of posts indicates an internal division of the village, of which we do not know exactly the meaning or usefulness; the northern part of the site, without houses, seems have been reserved for pasture and some activities such as flint knapping; archaeobotany: 21 samples were analysed fron Darion Colia taken from structures and burnt deposits; Jadin & Heim (2003, 345-392) describe a/bot samples retrieved from 39 structures at 7 early Neo sites in upper Geer (a Walloon municipality of Belgium, Province of Liege) during 10+ years of excavation; they state collection of plant remains was not systemmatic & comprised 4 different methods: direct sampling during the excavation (Fo); examination of the recovered charcoals (CHB) & burned ground/soil(?) frags (TB); & sieving/floating volumes of sediment for macro-remains (T) (they note that large taxa visible to the naked eye were sampled during excavation); plant impressions were also studied (preserved in the burnt ground/soil); flotation was carried out using sieve sizes ranging from c.5mm-c.0.1mm (see note on p348); densites of remains per unit volume of sediment & total numbers of taxa were calculated (table 4-4/4-3, 351-355)",S8513,wet-sieving,5.0mm-0.1mm,NULL
"the site is located in the north of the town of Hebecrevon on a plateau rising to 79 m between two stream courses along the RD 77 - this report presents evidence of the Middle Neolithic 1 occupation (Cerny); charcoal from the oven (St.10, us. 01) has been 14C dated at Lyon (J. Evin, 1998 Ly-8831) - the result obtained: 5765 +/- 50 BP or a range in actual years after correction of 4752 to 4494 BC (with a maximum of probabilities around 4648 and 4603 BC) can be compared with the dates of the eponymous Cerny or Cerny-Videlles of the Parisian Basin and confluence region of Seine-Yonne; 3 structures are described in the report: St.10/11 (in fact two features joined into one) interpreted as an kiln/oven/grain dryer; St9 and St.29 which are circular or semi-circular pits that also have evidence of burning - interpretation of their function is more problematic; archaeobotany: Dietsch-Sellami presents a/bot data from one of the structures - she states that all were sampled (10L volume) but that only the oven/kiln (and she refers to figure 4 which shows pits: St.9/St.29) produced any charred remains; 10L was taken from the top layer of the structure and was wet-sieved on 2 and 0.5mm sieves; she notes that the sample was rich in charcoal and produced 423 whole and/or fragmentary seeds",S8821,wet-sieving,"2.0mm, 0.5mm",NULL
"located approximately 12 km to the east of Clermont-Ferrand at an average altitude of 339m the site Dallet le Machal was under threat from gravel extraction and was the subject of a rescue excavation from 1990 under the direction of G. Loison; occupation extended over c.10ha; no habitation areas have been excavated so far and research focussed on 180 pit structures and 20 burials - pits are of variable shape and volume; 11 of them have a conical shape and are possibly silos; observations made at the excavation indicate a rapid filling of the pits - the burials were usually individual and at located at the periphery of the site; no 14C dates are recorded in the report; archaeobotany: sediments in several of the pits were sampled for charred plant remains - Bouby states that the entire contents of 20% of these were wet-sieved (smallest mesh size: 0.5mm); he also notes that some of the pits examined contained secondary burials; preservation of charred remains was generally very poor; in table 6(2) the taxa from the sieving exercise are listed - I've assumed that these taxa have already been included in the overall totals shown in table 6(1) (on the basis that numbers of items are exactly the same in both tables for some of the samples) [as at Cormail]",S8844,wet-sieving/dry-sieving,0.5mm,"mesh sizes listed for wet-sieving only; dry-sieving no mesh size recorded"
"Orcet - Le Tourteix (15 km south of Clermont-Ferrand) was a rescue excavation directed by G. Loison between 1981 and 1985; it is located on the edge of a marl-limestone shelf (former terrace of l'Auzon); the site dominates the Sarlieve Basin with rich brown calcareous soils - evidence indicates that the area was swampy during the occupation; the site extends over several hectares but the limits of the occupation are not clearly defined; habitation layers were not preserved but hollow structures including 20 pits and a circular opening tomb have been excavated; archaeobotany: systematic wet-sieving was carried out with a minimum mesh sieve equal to 0.5 mm. (volumes of sediment are sieved are currently unknown); lists of charred taxa are given (table 7) for pits 18 & 19 and tomb 1: the tomb and  pit 18 are in a same sector of the excavation while pit 19 is located at some distance in an area with more structures; preservation of the plant remains was poor and fragmentation was high; Bouby notes in the text that in pit 16 (adjoining the tomb) there were 11 fragments of an aggregate resembling a 'paste' food and the presence of many small cells could indicate particular the 'batter' had risen (cf. like bread)",S8845,wet-sieving,0.5mm,NULL
"the open air site of Bousquetas is in the commune of Paulham c. 1km NE of the town; the site was discovered during survey work carried out on alluvial formations on the right bank of the valley of the Herault where the gas pipeline crossed; in the area accessible for excavation 9 pits were identified and investigated - the group of structures probably belong to a much larger occupation the extent of which is not known; it was obvious on excavation that the site had undergone significant erosion and truncation of uppermost layers as a result of agriculture/ploughing; 3 of the 9 structures had a form that indicated they were former silos (FS1, FS5, FS9), FS3 & FS4 contained domestic rubbish, FS2 is thought to be a pit/cellar but its original function is less clear; archaeobotany: FS3 FS4 pits and were sampled for a/bot  analysis - the choice was motivated by the fill that comprised domestic rubbish (in the table they are described as 'ash pits'); a third structure pit FS2 also produced charred remains (mesh sizes used for ?wet-sieving are not given although only large grains/frags are listed and so presumably they were >1mm); volumes sampled are recorded and apparently for FS3 and FS4 10L (out of the total of 30L, 20L respectively) were 'subject to a comprehensive study' - not quite sure what this means; lists of taxa are given in figure 8",S8846,NULL,NULL,NULL
